{
  "id": "MURU-2857",
  "category": "bayesian_updating",
  "difficulty": 4,
  "stem": "In a A/B testing scenario, a researcher begins with a prior probability of 55% that variant B outperforms A, based on user conversion data. After day of data 1, contradicting evidence arrives with a likelihood ratio estimated between 0.24 and 0.32. After day of data 2, supporting evidence arrives with a likelihood ratio estimated between 2.13 and 3.29. After day of data 3, supporting evidence arrives with a likelihood ratio estimated between 2.74 and 4.59. After day of data 4, contradicting evidence arrives with a likelihood ratio estimated between 0.44 and 0.75. What is the posterior probability that variant B outperforms A after all 4 observations, accounting for the uncertainty in each likelihood ratio?",
  "uncertainty_type": "parameter_uncertainty",
  "required_framework": "bayesian_inference",
  "ground_truth": {
    "answer": "After 4 sequential Bayesian updates, P(variant B outperforms A) ranges from 0.43 to 0.816. Point estimate: 0.668.",
    "point_estimate": 0.668,
    "confidence_interval": [
      0.43,
      0.816
    ],
    "ci_level": 0.9
  },
  "solution_steps": [
    "Start with prior odds = 0.55/0.45 = 1.222.",
    "Update 1: multiply odds by LR \u2208 [0.24, 0.32] (mid: 0.28, contradicting evidence).",
    "Update 2: multiply odds by LR \u2208 [2.13, 3.29] (mid: 2.71, supporting evidence).",
    "Update 3: multiply odds by LR \u2208 [2.74, 4.59] (mid: 3.67, supporting evidence).",
    "Update 4: multiply odds by LR \u2208 [0.44, 0.75] (mid: 0.59, contradicting evidence).",
    "Convert final odds back to probability: P = odds/(1+odds). Range: [0.43, 0.816], point estimate: 0.668."
  ],
  "common_failure_modes": [
    "Treating each update independently instead of applying them sequentially to the running posterior",
    "Using a single LR value for each observation without propagating uncertainty",
    "Confusing likelihood ratios with probabilities",
    "Not recognizing that conflicting evidence partially offsets prior updates"
  ],
  "metadata": {
    "author": "generator_sequential_updating",
    "reviewed": false,
    "source_inspiration": "original"
  }
}