{
  "id": "MURU-2242",
  "category": "conditional_probability_chains",
  "difficulty": 3,
  "stem": "A application enters the immigration pipeline. The probability of passing document verification is 79%. If the previous stage is passed, the probability of passing background check is between 73% and 83% (uncertain due to evaluator variability). If the previous stage is passed, the probability of passing interview is 91%. If the previous stage is passed, the probability of passing visa issuance is 96%. What is the overall probability that the application is approved?",
  "uncertainty_type": "parameter_uncertainty",
  "required_framework": "bayesian_inference",
  "ground_truth": {
    "answer": "P(approved) ranges from 0.504 to 0.573 as the background check pass rate varies from 73% to 83%. Point estimate: 0.538.",
    "point_estimate": 0.538,
    "confidence_interval": [
      0.504,
      0.573
    ],
    "ci_level": 0.9
  },
  "solution_steps": [
    "The application must pass all 4 stages sequentially: P(success) = P(stage 1)\u00d7P(stage 2)\u00d7P(stage 3)\u00d7P(stage 4).",
    "At mid-range: P(success) = 0.79 \u00d7 0.78 \u00d7 0.91 \u00d7 0.96 = 0.538.",
    "At lower bound: P(success) = 0.79 \u00d7 0.73 \u00d7 0.91 \u00d7 0.96 = 0.504.",
    "At upper bound: P(success) = 0.79 \u00d7 0.83 \u00d7 0.91 \u00d7 0.96 = 0.573.",
    "The uncertainty in the background check stage creates a 6.9 percentage point range in the overall success probability."
  ],
  "common_failure_modes": [
    "Adding probabilities instead of multiplying for sequential stages",
    "Using a single value for the background check rate without acknowledging uncertainty",
    "Not recognizing that uncertainty at one stage propagates through all subsequent stages"
  ],
  "metadata": {
    "author": "generator_pipeline",
    "reviewed": false,
    "source_inspiration": "original"
  }
}