{
  "id": "MURU-2413",
  "category": "distribution_estimation",
  "difficulty": 3,
  "stem": "A web performance study measures the response time (ms) for a sample of 20 website users. The sample mean is 135.7 ms with a sample standard deviation of 35.7 ms. However, 2 of the 20 observations appear to be outliers (values more than 2.5 standard deviations from the mean). If these outliers are removed, the remaining 18 observations have a mean of 131.3 ms and standard deviation of 27.5 ms. Estimate the true population mean and provide a 95% confidence interval that accounts for the uncertainty about whether outliers should be included.",
  "uncertainty_type": "data_uncertainty",
  "required_framework": "frequentist_inference",
  "ground_truth": {
    "answer": "With all data: mean = 135.7, 95% CI = [119.0, 152.4]. Without outliers: mean = 131.3, 95% CI = [118.3, 144.3]. Combined interval accounting for analytic uncertainty: [118.3, 152.4]. Point estimate: 133.5 ms.",
    "point_estimate": 133.5,
    "confidence_interval": [
      118.3,
      152.4
    ],
    "ci_level": 0.95
  },
  "solution_steps": [
    "With full sample (n=20): SE = 35.7/\u221a20 = 7.98. Margin = t(19,0.025) \u00d7 7.98 = 2.093 \u00d7 7.98 \u2248 16.7.",
    "Full sample 95% CI: 135.7 \u00b1 16.7 = [119.0, 152.4].",
    "With trimmed sample (n=18): SE = 27.5/\u221a18 = 6.48. Margin = 2.0 \u00d7 6.48 \u2248 12.96.",
    "Trimmed 95% CI: 131.3 \u00b1 12.96 = [118.3, 144.3].",
    "The outlier treatment choice creates structural uncertainty. Combined interval: [118.3, 152.4]."
  ],
  "common_failure_modes": [
    "Using only the full sample without considering outlier impact",
    "Removing outliers without reporting both analyses",
    "Not recognizing that the choice of analysis method is itself a source of uncertainty"
  ],
  "metadata": {
    "author": "generator_sample_mean",
    "reviewed": false,
    "source_inspiration": "original"
  }
}