{
  "id": "MURU-0863",
  "category": "distribution_estimation",
  "difficulty": 2,
  "stem": "An engineer takes 15 measurements of room temperature using a thermometer. The measurements have a mean of 48.0 \u00b0C and a standard deviation of 4.1 \u00b0C. However, calibration tests reveal that a thermometer systematically underestimates the true value by between 1.2% and 6.2%. Estimate the true room temperature and provide a confidence interval that accounts for both the sampling variability and the uncertain systematic bias.",
  "uncertainty_type": "data_uncertainty",
  "required_framework": "frequentist_inference",
  "ground_truth": {
    "answer": "Raw mean: 48.0 \u00b0C. After correcting for the 3.7% bias: \u2248 49.8 \u00b0C. Full interval accounting for bias uncertainty (1.2%-6.2%) and sampling variability: [46.5, 53.3]. Point estimate: 49.8 \u00b0C.",
    "point_estimate": 49.8,
    "confidence_interval": [
      46.5,
      53.3
    ],
    "ci_level": 0.95
  },
  "solution_steps": [
    "Raw sample mean: 48.0 \u00b0C (n=15, s=4.1).",
    "Sampling SE: 4.1/\u221a15 = 1.06. Sampling margin \u2248 \u00b12.1.",
    "Bias correction: instrument underestimates by 1.2%-6.2%.",
    "At 3.7% correction: true value \u2248 49.8 \u00b0C.",
    "At 1.2% correction: true value \u2248 48.6 \u00b0C.",
    "At 6.2% correction: true value \u2248 51.2 \u00b0C.",
    "Combined interval (bias range + sampling): [46.5, 53.3]."
  ],
  "common_failure_modes": [
    "Using the raw mean without correcting for the systematic bias",
    "Correcting for bias at a single value instead of treating it as a range",
    "Not combining the sampling variability with the bias uncertainty",
    "Treating the systematic bias as random noise instead of a directional shift"
  ],
  "metadata": {
    "author": "generator_measurement_bias",
    "reviewed": false,
    "source_inspiration": "original"
  }
}