{
  "id": "MURU-0149",
  "category": "bayesian_updating",
  "difficulty": 1,
  "stem": "A radiology team is looking for a tumor. Based on initial analysis, they estimate a 55% probability that a tumor is in the left lobe and a 45% probability it is in the right lobe. They search the left lobe first and do not find a tumor. However, their search effectiveness is uncertain \u2014 conditions vary, and they estimate their detection probability in the left lobe is between 51% and 64%. Given they did not find a tumor in the left lobe, what is the updated probability that a tumor is in the right lobe?",
  "uncertainty_type": "parameter_uncertainty",
  "required_framework": "bayesian_inference",
  "ground_truth": {
    "answer": "P(the right lobe | not found in the left lobe) ranges from 0.625 to 0.694 as detection probability varies from 51% to 64%. Point estimate at 57% detection: 0.655.",
    "point_estimate": 0.655,
    "confidence_interval": [
      0.625,
      0.694
    ],
    "ci_level": 0.9
  },
  "solution_steps": [
    "Apply Bayes' theorem for negative evidence: P(B|\u00acfound_A) = P(\u00acfound_A|B)\u00d7P(B) / P(\u00acfound_A).",
    "If target is in B: P(\u00acfound in A | in B) = 1 (cannot find what isn't there).",
    "If target is in A: P(\u00acfound in A | in A) = 1 - detection_probability.",
    "P(\u00acfound_A) = (1-det)\u00d70.55 + 1\u00d70.45.",
    "At detection 57%: P(B|\u00acfound) = 0.45 / (0.43\u00d70.55 + 0.45) \u2248 0.655.",
    "At detection 51%: P(B|\u00acfound) \u2248 0.625.",
    "At detection 64%: P(B|\u00acfound) \u2248 0.694."
  ],
  "common_failure_modes": [
    "Assuming not finding in the left lobe means it is definitely in the right lobe",
    "Ignoring the uncertain detection probability and using a single value",
    "Not applying Bayes' theorem correctly for negative evidence (absence of detection)"
  ],
  "metadata": {
    "author": "generator_search",
    "reviewed": false,
    "source_inspiration": "original"
  }
}