{
  "id": "MURU-1677",
  "category": "decision_under_uncertainty",
  "difficulty": 3,
  "stem": "A decision-maker must choose between two options. Option A (the established treatment) yields a guaranteed return of $112K. Option B (the experimental treatment) depends on patient response rate: with probability 32-49% (uncertain), it yields $237K; otherwise it yields $35K. Compute the expected value of each option and determine which is better. How does the uncertainty in patient response rate affect the recommendation?",
  "uncertainty_type": "parameter_uncertainty",
  "required_framework": "decision_theory",
  "ground_truth": {
    "answer": "EV(A) = $112K (fixed). EV(B) ranges from $99.6K to $134.0K. Point estimate: $117.8K. Option B is preferred at most assumptions (EV_B > EV_A when P(good) > 38.1%).",
    "point_estimate": 117.8,
    "confidence_interval": [
      99.6,
      134.0
    ],
    "ci_level": 0.9
  },
  "solution_steps": [
    "EV(A) = $112K (guaranteed).",
    "EV(B) = P(good)\u00d7$237K + (1-P(good))\u00d7$35K.",
    "At P(good)=0.41: EV(B) = 0.41\u00d7237 + 0.59\u00d735 = $117.8K.",
    "At P(good)=0.32: EV(B) = $99.6K.",
    "At P(good)=0.49: EV(B) = $134.0K.",
    "Breakeven probability: P(good) = (112-35) / (237-35) = 0.381.",
    "The decision switches at P(good) = 38.1%, which falls within the uncertainty range."
  ],
  "common_failure_modes": [
    "Picking a single probability and giving a definitive recommendation without sensitivity analysis",
    "Not computing the breakeven probability where the optimal decision switches",
    "Ignoring the range of outcomes and focusing only on expected values (risk-neutral assumption)"
  ],
  "metadata": {
    "author": "generator_decision",
    "reviewed": false,
    "source_inspiration": "original"
  }
}