{
  "id": "MURU-2239",
  "category": "adversarial_ambiguity",
  "difficulty": 2,
  "stem": "In project estimation, you are asked to estimate the project completion time. You are first told that a sales team's promise to the client puts the value at 100.0 months. You then collect your own data: historical data on similar projects based on 20 observations give a mean of 179.0 months with SD = 27.0 months. How should you combine the anchor with your data? How much, if at all, should the anchor influence your estimate? Provide a point estimate and confidence interval.",
  "uncertainty_type": "epistemic_uncertainty",
  "required_framework": "bayesian_inference",
  "ground_truth": {
    "answer": "The anchor (100.0 months) likely underestimates the true value. Data-based estimate: 179.0 months, CI = [167.2, 190.8]. If the anchor receives 0-30% weight, the estimate ranges from 155.3 to 168.7. Point estimate: 179.0 months (data-only, unanchored).",
    "point_estimate": 179.0,
    "confidence_interval": [
      155.3,
      190.8
    ],
    "ci_level": 0.95
  },
  "solution_steps": [
    "Anchor: 100.0 months (from a sales team's promise to the client \u2014 potentially biased).",
    "Data: mean = 179.0, SD = 27.0, n = 20. SE = 6.0.",
    "Data-based 95% CI: [167.2, 190.8].",
    "The anchor underestimates relative to the data by 79 months (44%).",
    "If we assign the anchor weight w \u2208 [0, 0.3]: estimate = w\u00d7100.0 + (1-w)\u00d7179.0.",
    "At w=0.21: estimate = 162.4.",
    "Best practice: the data-based estimate (179.0) should dominate since it has an objective basis. The anchor should receive minimal weight."
  ],
  "common_failure_modes": [
    "Being anchored by the initial value (100.0) and insufficiently adjusting toward the data",
    "Giving equal weight to the anchor and data despite the anchor's questionable provenance",
    "Not recognizing that the anchor (100.0) and data (179.0) are substantially different, suggesting bias in the anchor"
  ],
  "metadata": {
    "author": "generator_anchoring_manipulation",
    "reviewed": false,
    "source_inspiration": "original"
  }
}