{
  "id": "MURU-2022",
  "category": "distribution_estimation",
  "difficulty": 5,
  "stem": "A materials science dataset contains 50 observations of tensile strength. The data is believed to come from a mixture of two populations: bulk material (mean \u2248 78.2 MPa, SD \u2248 16.6) and surface-treated material (mean \u2248 146.1 MPa, SD \u2248 19.7). The proportion of bulk material in the sample is uncertain, estimated between 45% and 70%. The observed overall mean is 107.4 MPa with SD = 38.1. Estimate the true population mean of tensile strength, accounting for the uncertainty in the mixing proportion.",
  "uncertainty_type": "model_uncertainty",
  "required_framework": "bayesian_inference",
  "ground_truth": {
    "answer": "Mixture mean = w\u00d778.2 + (1-w)\u00d7146.1. As w varies from 0.45 to 0.7, the mixture mean ranges from 98.6 to 115.5. With sampling variability, CI = [88.0, 126.1]. Point estimate at w=0.57: 107.4 MPa.",
    "point_estimate": 107.4,
    "confidence_interval": [
      88.0,
      126.1
    ],
    "ci_level": 0.95
  },
  "solution_steps": [
    "Mixture mean formula: \u03bc_mix = w \u00d7 \u03bc_A + (1-w) \u00d7 \u03bc_B.",
    "At w=0.57: \u03bc_mix = 0.57\u00d778.2 + 0.43\u00d7146.1 = 107.4.",
    "At w=0.45: \u03bc_mix = 115.5 (more of surface-treated material).",
    "At w=0.7: \u03bc_mix = 98.6 (more of bulk material).",
    "Mixture SD \u2248 38.1. SE = 38.1/\u221a50 = 5.39.",
    "Combined interval [88.0, 126.1] accounts for both mixing uncertainty and sampling variability."
  ],
  "common_failure_modes": [
    "Using the simple average of the two component means without weighting",
    "Treating the mixing proportion as known instead of uncertain",
    "Ignoring that the overall SD (38.1) is inflated by the between-component variation",
    "Not recognizing that the mixture variance includes both within-component and between-component variation",
    "Failing to propagate the uncertainty in mixing weights through to the final interval"
  ],
  "metadata": {
    "author": "generator_mixture_distribution",
    "reviewed": false,
    "source_inspiration": "original"
  }
}