{
  "id": "MURU-2065",
  "category": "distribution_estimation",
  "difficulty": 2,
  "stem": "A precision manufacturing study measures bolt diameter for 25 samples to determine if the process variability is within \u00b10.05mm of the target. The sample standard deviation is 4.99 mm (sample variance = 24.89). Estimate the true population standard deviation of bolt diameter and provide a 95% confidence interval.",
  "uncertainty_type": "data_uncertainty",
  "required_framework": "frequentist_inference",
  "ground_truth": {
    "answer": "Sample SD = 4.99 mm. 95% CI for \u03c3 (chi-squared): [3.9, 6.94]. Point estimate: 4.99 mm.",
    "point_estimate": 4.99,
    "confidence_interval": [
      3.9,
      6.94
    ],
    "ci_level": 0.95
  },
  "solution_steps": [
    "Sample variance s\u00b2 = 24.89, df = 24.",
    "\u03c7\u00b2 CI for \u03c3\u00b2: [(n-1)s\u00b2/\u03c7\u00b2_upper, (n-1)s\u00b2/\u03c7\u00b2_lower] = [24\u00d724.89/39.364, 24\u00d724.89/12.401] = [15.18, 48.17].",
    "CI for \u03c3: [\u221a15.18, \u221a48.17] = [3.9, 6.94]."
  ],
  "common_failure_modes": [
    "Using z-based CI for the mean instead of \u03c7\u00b2-based CI for the variance",
    "Reporting the sample SD (4.99) as the population SD without uncertainty",
    "Not recognizing that confidence intervals for variance are asymmetric"
  ],
  "metadata": {
    "author": "generator_variance_estimation",
    "reviewed": false,
    "source_inspiration": "original"
  }
}