{
  "id": "MURU-2376",
  "category": "conditional_probability_chains",
  "difficulty": 4,
  "stem": "A telecommunications communication network uses 3 parallel relays for redundancy. The message delivered requires at least one relay to function. relay 1 has a reliability of 75%. relay 2 has a reliability of 95%. relay 3 has a reliability between 62% and 73% (uncertain due to limited operational data). Additionally, there is a common-cause failure probability (e.g., power outage, shared software bug) that could disable all relays simultaneously, estimated between 2.8% and 6.4%. What is the overall probability that the message delivered?",
  "uncertainty_type": "parameter_uncertainty",
  "required_framework": "bayesian_inference",
  "ground_truth": {
    "answer": "P(message delivered) ranges from 0.9315 to 0.9687. Point estimate: 0.9502.",
    "point_estimate": 0.9502,
    "confidence_interval": [
      0.9315,
      0.9687
    ],
    "ci_level": 0.9
  },
  "solution_steps": [
    "P(system works) = 1 - P(all 3 relays fail simultaneously).",
    "P(all fail) = (1-R_1) \u00d7 (1-R_2) \u00d7 (1-R_3).",
    "At mid-range: P(all fail) = 0.25 \u00d7 0.05 \u00d7 0.32 = 0.004. P(works) = 0.996.",
    "At lower bound: P(all fail) = 0.25 \u00d7 0.05 \u00d7 0.38 = 0.0048. P(works) = 0.9952.",
    "At upper bound: P(all fail) = 0.25 \u00d7 0.05 \u00d7 0.27 = 0.0034. P(works) = 0.9966.",
    "With common-cause failure (2.8%-6.4%): P(works) = (1-P_cc) \u00d7 P(independent works). Range: [0.9315, 0.9687]."
  ],
  "common_failure_modes": [
    "Multiplying individual reliabilities instead of computing 1 - P(all fail)",
    "Using a single reliability for the uncertain component without propagating uncertainty",
    "Treating the system as a series (all must work) rather than parallel (any one suffices)",
    "Ignoring common-cause failures that can disable all paths simultaneously"
  ],
  "metadata": {
    "author": "generator_parallel_redundancy",
    "reviewed": false,
    "source_inspiration": "original"
  }
}