{
  "id": "MURU-0842",
  "category": "bayesian_updating",
  "difficulty": 1,
  "stem": "A factory produces solar panels using two sources. Automated Line East handles 69% of production with a known defect rate of 4.0%. Automated Line West handles 31% of production, but its defect rate is uncertain \u2014 recent quality audits suggest it lies between 5.6% and 11.2%, depending on raw material batch quality. A randomly selected solar panel is found to be defective. What is the probability it came from Automated Line West?",
  "uncertainty_type": "parameter_uncertainty",
  "required_framework": "bayesian_inference",
  "ground_truth": {
    "answer": "P(Automated Line West | defective) ranges from 0.386 to 0.557 as Automated Line West's defect rate varies from 5.6% to 11.2%. Point estimate at 8.4%: 0.485.",
    "point_estimate": 0.485,
    "confidence_interval": [
      0.386,
      0.557
    ],
    "ci_level": 0.9
  },
  "solution_steps": [
    "Apply Bayes' theorem: P(B|def) = P(def|B)\u00d7P(B) / [P(def|A)\u00d7P(A) + P(def|B)\u00d7P(B)].",
    "At defect rate 8.4%: P(B|def) = 0.084\u00d70.31 / (0.04\u00d70.69 + 0.084\u00d70.31) \u2248 0.485.",
    "At defect rate 5.6%: P(B|def) \u2248 0.386.",
    "At defect rate 11.2%: P(B|def) \u2248 0.557.",
    "The interval [0.386, 0.557] captures the range of posterior probabilities."
  ],
  "common_failure_modes": [
    "Using only the midpoint defect rate and providing a single answer",
    "Ignoring the production proportions (69/31 split)",
    "Comparing defect rates directly without applying Bayes' theorem"
  ],
  "metadata": {
    "author": "generator_quality_control",
    "reviewed": false,
    "source_inspiration": "original"
  }
}