{
  "id": "MURU-2810",
  "category": "bayesian_updating",
  "difficulty": 1,
  "stem": "A archaeology team is looking for a buried artifact. Based on initial analysis, they estimate a 50% probability that a buried artifact is in Dig Site North and a 50% probability it is in Dig Site South. They search Dig Site North first and do not find a buried artifact. However, their search effectiveness is uncertain \u2014 conditions vary, and they estimate their detection probability in Dig Site North is between 55% and 78%. Given they did not find a buried artifact in Dig Site North, what is the updated probability that a buried artifact is in Dig Site South?",
  "uncertainty_type": "parameter_uncertainty",
  "required_framework": "bayesian_inference",
  "ground_truth": {
    "answer": "P(Dig Site South | not found in Dig Site North) ranges from 0.69 to 0.82 as detection probability varies from 55% to 78%. Point estimate at 67% detection: 0.752.",
    "point_estimate": 0.752,
    "confidence_interval": [
      0.69,
      0.82
    ],
    "ci_level": 0.9
  },
  "solution_steps": [
    "Apply Bayes' theorem for negative evidence: P(B|\u00acfound_A) = P(\u00acfound_A|B)\u00d7P(B) / P(\u00acfound_A).",
    "If target is in B: P(\u00acfound in A | in B) = 1 (cannot find what isn't there).",
    "If target is in A: P(\u00acfound in A | in A) = 1 - detection_probability.",
    "P(\u00acfound_A) = (1-det)\u00d70.5 + 1\u00d70.5.",
    "At detection 67%: P(B|\u00acfound) = 0.5 / (0.33\u00d70.5 + 0.5) \u2248 0.752.",
    "At detection 55%: P(B|\u00acfound) \u2248 0.69.",
    "At detection 78%: P(B|\u00acfound) \u2248 0.82."
  ],
  "common_failure_modes": [
    "Assuming not finding in Dig Site North means it is definitely in Dig Site South",
    "Ignoring the uncertain detection probability and using a single value",
    "Not applying Bayes' theorem correctly for negative evidence (absence of detection)"
  ],
  "metadata": {
    "author": "generator_search",
    "reviewed": false,
    "source_inspiration": "original"
  }
}