{
  "id": "MURU-0482",
  "category": "bayesian_updating",
  "difficulty": 3,
  "stem": "A factory produces pharmaceutical tablets using two sources. Batch Process Alpha handles 56% of production with a known defect rate of 1.5%. Batch Process Beta handles 44% of production, but its defect rate is uncertain \u2014 recent quality audits suggest it lies between 7.8% and 13.1%, depending on raw material batch quality. A randomly selected pharmaceutical tablet is found to be defective. What is the probability it came from Batch Process Beta?",
  "uncertainty_type": "parameter_uncertainty",
  "required_framework": "bayesian_inference",
  "ground_truth": {
    "answer": "P(Batch Process Beta | defective) ranges from 0.803 to 0.873 as Batch Process Beta's defect rate varies from 7.8% to 13.1%. Point estimate at 10.5%: 0.846.",
    "point_estimate": 0.846,
    "confidence_interval": [
      0.803,
      0.873
    ],
    "ci_level": 0.9
  },
  "solution_steps": [
    "Apply Bayes' theorem: P(B|def) = P(def|B)\u00d7P(B) / [P(def|A)\u00d7P(A) + P(def|B)\u00d7P(B)].",
    "At defect rate 10.5%: P(B|def) = 0.105\u00d70.44 / (0.015\u00d70.56 + 0.105\u00d70.44) \u2248 0.846.",
    "At defect rate 7.8%: P(B|def) \u2248 0.803.",
    "At defect rate 13.1%: P(B|def) \u2248 0.873.",
    "The interval [0.803, 0.873] captures the range of posterior probabilities."
  ],
  "common_failure_modes": [
    "Using only the midpoint defect rate and providing a single answer",
    "Ignoring the production proportions (56/44 split)",
    "Comparing defect rates directly without applying Bayes' theorem"
  ],
  "metadata": {
    "author": "generator_quality_control",
    "reviewed": false,
    "source_inspiration": "original"
  }
}