{
  "id": "MURU-0126",
  "category": "bayesian_updating",
  "difficulty": 2,
  "stem": "A hospital uses a PSA blood test to screen for prostate cancer. The test has a sensitivity of 86% and a specificity of 88%. The prevalence of prostate cancer in the patient population is estimated to be between 1.9% and 3.6%, with uncertainty due to regional variation and demographic differences in the hospital's catchment area. A patient receives a positive test result. What is the probability that the patient actually has prostate cancer? Provide your answer as a probability with a confidence interval reflecting the uncertainty in prevalence.",
  "uncertainty_type": "parameter_uncertainty",
  "required_framework": "bayesian_inference",
  "ground_truth": {
    "answer": "P(prostate cancer | positive test) ranges from 0.122 to 0.211 as prevalence varies from 1.9% to 3.6%. Point estimate at 2.7% prevalence: 0.166.",
    "point_estimate": 0.166,
    "confidence_interval": [
      0.122,
      0.211
    ],
    "ci_level": 0.9
  },
  "solution_steps": [
    "Apply Bayes' theorem: P(D|+) = P(+|D)\u00d7P(D) / [P(+|D)\u00d7P(D) + P(+|\u00acD)\u00d7P(\u00acD)], where P(+|\u00acD) = 1-specificity = 0.12.",
    "At prevalence 2.7%: P(D|+) = 0.86\u00d70.027 / (0.86\u00d70.027 + 0.12\u00d70.973) \u2248 0.166.",
    "At prevalence 1.9%: P(D|+) = 0.86\u00d70.019 / (0.86\u00d70.019 + 0.12\u00d70.981) \u2248 0.122.",
    "At prevalence 3.6%: P(D|+) = 0.86\u00d70.036 / (0.86\u00d70.036 + 0.12\u00d70.964) \u2248 0.211.",
    "The confidence interval [0.122, 0.211] reflects the range of posterior probabilities over plausible prevalence values."
  ],
  "common_failure_modes": [
    "Confusing sensitivity (86%) with positive predictive value",
    "Providing only a point estimate without acknowledging the prevalence uncertainty",
    "Ignoring the base rate (prevalence) and using the test sensitivity as the answer"
  ],
  "metadata": {
    "author": "generator_medical_test",
    "reviewed": false,
    "source_inspiration": "original"
  }
}