{
  "id": "MURU-1969",
  "category": "conditional_probability_chains",
  "difficulty": 4,
  "stem": "A product enters the manufacturing pipeline. The probability of passing raw material inspection is 77%. If the previous stage is passed, the probability of passing machining is 85%. If the previous stage is passed, the probability of passing assembly is between 70% and 83% (uncertain due to evaluator variability). If the previous stage is passed, the probability of passing final QA is 80%. What is the overall probability that the product is shipped?",
  "uncertainty_type": "parameter_uncertainty",
  "required_framework": "bayesian_inference",
  "ground_truth": {
    "answer": "P(shipped) ranges from 0.367 to 0.435 as the assembly pass rate varies from 70% to 83%. Point estimate: 0.398.",
    "point_estimate": 0.398,
    "confidence_interval": [
      0.367,
      0.435
    ],
    "ci_level": 0.9
  },
  "solution_steps": [
    "The product must pass all 4 stages sequentially: P(success) = P(stage 1)\u00d7P(stage 2)\u00d7P(stage 3)\u00d7P(stage 4).",
    "At mid-range: P(success) = 0.77 \u00d7 0.85 \u00d7 0.76 \u00d7 0.8 = 0.398.",
    "At lower bound: P(success) = 0.77 \u00d7 0.85 \u00d7 0.7 \u00d7 0.8 = 0.367.",
    "At upper bound: P(success) = 0.77 \u00d7 0.85 \u00d7 0.83 \u00d7 0.8 = 0.435.",
    "The uncertainty in the assembly stage creates a 6.8 percentage point range in the overall success probability."
  ],
  "common_failure_modes": [
    "Adding probabilities instead of multiplying for sequential stages",
    "Using a single value for the assembly rate without acknowledging uncertainty",
    "Not recognizing that uncertainty at one stage propagates through all subsequent stages"
  ],
  "metadata": {
    "author": "generator_pipeline",
    "reviewed": false,
    "source_inspiration": "original"
  }
}